text,label
We took hooch for a walk toaday and i fell over! Splat! Grazed my knees and everything! Should have stayed at home! See you tomorrow!,0
Yes but i dont care! I need you bad princess!,0
Our brand new mobile music service is now live. The free music player will arrive shortly. Just install on your phone to browse content from the top artists.,1
Great escape. I fancy the bridge but needs her lager. See you tomo,0
Where are you ? You said you would be here when I woke emoji,0
I wait number inside da car park,0
Aww thats the first time u said u missed me without asking if I missed u first. You DO love me! emoji,0
Think ur smart ? Win currency number this week in our weekly quiz text PLAY to number now!TCs WinnersClub PO BOX number M number number UZ. number . GBP number week,1
From tomorrow onwards eve number to number work.,0
I had been hoping i would not have to send you this message. My rent is due and i dont have enough for it. My reserves are completely gone. Its a loan i need and was hoping you could her. The balance is ltgt . Is there a way i could get that from you till mid march when i hope to pay back.,0
Ok. There may be a free gym about.,0
Do you want a New Nokia number i Colour Phone Delivered Tomorrow? With number FREE minutes to any mobile number FREE text FREE camcorder Reply or Call number,1
Want to finally have lunch today?,0
It does it on its own. Most of the time it fixes my spelling. But sometimes it gets a completely diff word. Go figure,0
XMAS Prize draws! We are trying to contact U. Todays draw shows that you have won a currency number prize GUARANTEED. Call number from land line. Valid number hrs only,1
Sorry got a late start were on the way,0
No but heard abt tat,0
Yo we are watching a movie on netflix,0
Are you driving or training?,0
Yar he quite clever but aft many guesses lor. He got ask me number bring but i thk darren not so willing number go. Aiya they thk leona still not attach wat.,0
Great to hear you are settling well. So whats happenin wit ola?,0
I accidentally deleted the message. Resend please.,0
Congrats! number mobile number G Videophones R yours. call number now! videochat wid ur mates play java games Dload polyH music noline rentl. bx number ip number number we. number pm,1
I hope your alright babe? I worry that you might have felt a bit desparate when you learned the job was a fake ? I am here waiting when you come back my love,0
Alright were hooked up where you guys at,0
Eat jap done oso aft ur lect wat got lect at number rite,0
Imagine you finally get to sink into that bath after I have put you through your paces maybe even having you eat me for a while before I left But also imagine the feel of that cage on your cock surrounded by the bath water reminding you always who owns you Enjoy my cuck,0
Me hungry buy some food good lei But mum n yun dun wan juz buy a little bit,0
Im gonna say no. Sorry. I would but as normal am starting to panic about time. Sorry again! Are you seeing on Tuesday?,0
Life spend with someone for a lifetime may be meaningless but a few moments spent with someone who really love you means more than life itself,0
I have to take exam with march number,0
Lol you wont feel bad when I use her money to take you out to a steak dinner D,0
How much did ur hdd casing cost.,0
Ball is moving a lot.will spin in last emoji so very difficult to bat emoji,0
collecting ur laptop then going to configure da settings izzit?,0
Ya very nice. . .be ready on thursday,0
Well im gonna finish my bath now. Have a good fine night.,0
Hi Petey!noim ok just wanted number chat coz avent spoken number u number a long timehope ur doin alrite.have good nit at js love ya am.x,0
From here after The performance award is calculated every two month.not for current one month period,0
Dont put your phone on silent mode ok,0
The new deus ex game comin early next yr,0
Great. Hope you are using your connections from mode men also cos you can never know why old friends can lead you to today,0
Full heat pa emoji i have applyed oil pa.,0
K ill drink.pa then what doing. I need srs model pls send it to my mail id pa.,0
All was well until slightly disastrous class this pm with my fav darlings! Hope day off ok. Coffee wld be good as cant stay late tomorrow. Same time place as always?,0
Hmmm . Mayb can try e shoppin area one but forgot e name of hotel,0
Im nt goin got somethin on unless they meetin number dinner lor Haha i wonder who will go tis time,0
Am new number club dont fink we met yet Will B gr number number C U Please leave msg number day wiv ur area number reply promised CARLIE x Calls currency number minMobsmore LKPOBOX number HP number FL,1
We are pleased to inform that your application for Airtel Broadband is processed successfully. Your installation will happen within number days.,0
As usual iam fine happy amp doing well emoji,0
Jays getting really impatient and belligerent,0
FREE MESSAGEThanks for using the Auction Subscription Service. number . number pMSGRCVD number Skip an Auction txt OUT. number Unsubscribe txt STOP CustomerCare number,1
Oh thats late! Well have a good night and i will give u a call tomorrow. Iam now going to go to sleep night night,0
Nt yet chikku simple habba hw abt u?,0
Now? Im going out number dinner soon,0
u r a winner U ave been specially selected number receive currency number cash or a number holiday (flights inc) speak to a live operator number claim number pmin ( number ),1
tells u number call number to claim currency number prize. U have number enter all ur mobile personal details the prompts. Careful!,1
Check audreys status right now,0
Friendship is not a game to play It is not a word to say It doesnt start on March and ends on May It is tomorrow yesterday today and e,0
I only work from mon to thurs but Sat i cant leh Booked liao Which other day u free?,0
Good morning pookie pie! Lol hope I didnt wake u up,0
U coming number pick me?,0
Where can download clear movies. Dvd copies.,0
Just looked it up and addie goes back Monday sucks to be her,0
When did i use soc I use it only at home dunno how number type it in word ar,0
Im meeting Darren,0
Hello darlin ive finished college now so txt me when u finish if u can love Kate xxx,0
Den wat will e schedule b lk on sun?,0
That means get the door,0
thk of wat to eat tonight.,0
Sorry that was my uncle. I.ll keep in touch,0
Bognor it is! Should be splendid at this time of year.,0
I get out of class in bsn in like ltgt minutes you know where advising is?,0
Im in class. Did you get my text.,0
Ic. There are a lotta childporn cars then.,0
In which place do you want da.,0
Im a guy browsin is compulsory,0
Friendship poem: Dear O Dear U R Not Near But I Can Hear Dont Get Fear Live With Cheer No More Tear U R Always my Dear. Gud ni number,0
If you dont respond imma assume youre still asleep and imma start calling n shit,0
Dude avatar number d was imp. At one point i thought there were actually flies in the room and almost tried hittng one as a reflex,0
No objection. My bf not coming.,0
Ok which your another number,0
If india win or level series means this is record emoji,0
No go. No openings for that room til after thanksgiving without an upcharge.,0
Very hurting n meaningful lines ever: I compromised everything for my love But at d end my love compromised me for everything emoji Gud mornin emoji,0
Were trying to find a Chinese food place around here,0
The affidavit says ltgt E Twiggs St division g courtroom ltgt ltTIMEgt AM. Ill double check and text you again tomorrow,0
Is ur paper in e morn or aft tmr?,0
URGENT! Your mobile No number xxx WON a currency number number Bonus Caller Prize on number number number ! This is the number nd attempt to reach YOU! Call number ASAP! BOX number N number QP number ppm,1
Keep my payasam there if rinu brings,0
Hmm Bits and pieces lol sighs,0
Baaaaabe! I misss youuuuu ! Where are you ? I have to go and teach my class at number,0
Sorry its a lot of friendofafriend stuff Im just now about to talk to the actual guy who wants to buy,0
In meeting da. I will call you,0
Would really appreciate if you call me. Just need someone to talk to.,0
K Ill take care of it,0
Then u better go sleep Dun disturb u liao U wake up then msg me lor,0
My friend shes studying at warwick weve planned to go shopping and to concert tmw but it may be canceled havnt seen for ages yeah we should get together sometime!,0
number days to kick off! For Euro number U will be kept up to date with the latest news and results daily. To be removed send GET TXT STOP to number,1
Urgent! call number from landline. Your complementary number Tenerife Holiday or currency number number cash await collection SAE TCs PO Box number WA number number PX number ppm number Sender: Hol Offer,1
I will come tomorrow di,0
No its true kDo u knw dis no. ltgt ?,0
WOT STUDENT DISCOUNT CAN U GET ON BOOKS?,0
Its a big difference. ltgt versus ltgt every ltgt hrs,0
Nah dub but je still buff,0
number in cbe. number in chennai.,0
You have been specially selected to receive a number award! Call number BEFORE the lines close. Cost number ppm. number . TCs apply. AG Promo,1
Thanx a lot,0
Great! How is the office today?,0
Apo all other are mokka players only,0
Ooooooh I forgot to tell u I can get on yoville on my phone,0
money!!! you r a lucky winner ! number claim your prize text money number number over currency number million to give away ! ppt number x number normal text rate box number w number t number jy,1
Alright if youre sure let me know when youre leaving,0
What type of stuff do you sing?,0
Lol you forgot it eh ? Yes Ill bring it in babe,0
Hey there! Glad u r better now. I hear u treated urself to a digi cam is it good? We r off at number pm. Have a fab new year c u in coupla wks!,0
HELLO U.CALL WEN U FINISH WRK.I FANCY MEETIN UP WIV U ALL TONITE AS I NEED A BREAK FROM DABOOKS. DID number HRS LAST NITE number TODAY OF WRK!,0
Beautiful Truth against Gravity Read carefully: Our heart feels light when someone is in it But it feels very heavy when someone leaves it GOOD NIGHT,0
WE REGRET TO INFORM U THAT THE NHS HAS MADE A MISTAKE.U WERE NEVER ACTUALLY BORN.PLEASE REPORT number YOR LOCAL HOSPITAL number B TERMINATED.WE R SORRY number THE INCONVENIENCE,0
Gumbys has a special where a ltgt cheese pizza is currency number so I know what were doin tonight,0
Im reaching home in number min.,0
URGENT! Your Mobile No number was awarded a currency number number Bonus Caller Prize on number number number ! This is our number nd attempt to contact YOU! Call number number number BOX number QU,1
Science tells that chocolate will melt under the sunlight. Please dont walk under the sunlight. BCozI dont want to loss a sweet friend.,0
To review and KEEP the fantastic Nokia NGage game deck with Club Nokia go number www.cnupdates.comnewsletter. unsubscribe from alerts reply with the word OUT,1
Had your mobile number mths? Update to latest Orange cameravideo phones for FREE. Save currency s with Free textsweekend calls. Text YES for a callback orno to opt out,1
The battery is for mr adewale my uncle. Aka Egbon,0
No one interested. May be some business plan.,0
Desires u going to doctor number liver. And get a bit stylish. Get ur hair managed. Thats it.,0
She said do u mind if I go into the bedroom for a minute ? OK I sed in a sexy mood. She came out number minuts latr wid a cake n My Wife,0
Boy I love u Grl: Hogolo Boy: gold chain kodstini Grl: Agalla Boy: necklace madstini Grl: agalla Boy: Hogli number mutai eerulli kodthini! Grl: I love U kano),0
Are you at work right now ?,0
Im job profile seems like bpo,0
And smile for me right now as you go and the world will wonder what you are smiling about and think your crazy and keep away from you grins,0
hey looks like I was wrong and one of the kappa guys numbers is still on my phone if you want I can text him and see if hes around,0
Are you going to write ccna exam this week??,0
Get ready for ltgt inches of pleasure,0
Ive reached home n i bathe liao U can call me now,0
Ya that one is slow as poo,0
I borrow ur bag ok.,0
K then come wenever u lik to come and also tel vikky to come by getting free time emoji,0
Well boy am I glad G wasted all night at applebees for nothing,0
Dont know you bring some food,0
He didnt see his shadow. We get an early spring yay,0
Good FRIENDS CaRE for each Other CLoSE Friends UNDERSTaND each Other and TRUE Friends STaY forever beyond words beyond time. Gud ni number,0
Then ur physics get a?,0
I see a cup of coffee animation,0
Yeah my usual guys out of town but therere definitely people around I know,0
Weightloss! No more girl friends. Make loads of money on ebay or something. And give thanks to God.,0
Is there coming friday is leave for pongal?do you get any news from your work place.,0
Really good emoji dhanush rocks once again emoji,0
Were finally ready fyi,0
Its like that hotel dusk game i think. You solve puzzles in a area thing,0
Me too baby! I promise to treat you well! I bet you will take good care of me,0
You have won ? number number cash or a ? number number prize! To claim call number,1
Its only currency number ard rest all ard currency number at least Which is price number number bedrm ( currency number ),0
Ure welcome Caught u using broken english again,0
Ur cashbalance is currently number pounds to maximize ur cashin now send CASH to number only number pmsg. CC: number HGSuite number number Lands RowW number J number HL,1
WHORE YOU ARE UNBELIEVABLE.,0
Ok ive sent u da latest version of da project.,0
Oops Ill let you know when my roommates done,0
Total video converter free download type this in google search emoji,0
Oh my love its soooo good to hear from you. Omg I missed you so much today. Im sorry your having problems with the provider but thank you for tming me,0
It certainly puts things into perspective when something like this happens,0
Good. No swimsuit allowed emoji,0
K.k emoji when are you going?,0
Moby Pub Quiz.Win a currency number High Street prize if u know who the new Duchess of Cornwall will be? Txt her first name to number unsub STOP currency number number SP,1
I am going to sao mu today. Will be done only at number,0
Right it wasnt you who phoned it was someone with a number like yours!,0
Hi this is yijue Its regarding the number textbook its intro to algorithms second edition Im selling it for currency number,0
Like ltgt same question,0
I will spoil you in bed as well emoji,0
hi baby im cruisin with my girl friend what r u up number ? give me a call in and hour at home if thats alright or fone me on this fone now love jenny xxx,0
Got meh When?,0
Sorry dude. Dont know how i forgot. Even after Dan reminded me. Sorry. Hope you guys had fun.,0
Happy new year to u too!,0
Okey dokey ill be over in a bit just sorting some stuff out.,0
I was just callin to say hi. Take care bruv!,0
Miserable. They dont tell u that the side effects of birth control are massive gut wrenching cramps for the first number months. I didnt sleep at all last night.,0
Whos there say hi to our drugdealer,0
Its ok i noe ure busy but im really too bored so i msg u. I oso dunno wat colour she choose number me one.,0
Huh means computational science Y they like dat one push here n there,0
Pls whats the full name of jokes school cos fees in university of florida seem to actually be ltgt k. Pls holla back,0
our mobile number has won currency number to claim calls us back or ring the claims hot line on number,1
MAKE SURE ALEX KNOWS HIS BIRTHDAY IS OVER IN FIFTEEN MINUTES AS FAR AS YOURE CONCERNED,0
Nah cant help you there Ive never had an iphone,0
Aiyo Her lesson so early Im still sleepin haha Okie u go home liao den confirm w me lor,0
Lol wtf random. Btw is that your lunch break,0
Thanx. Yup we coming back on sun. Finish dinner going back number hotel now. Time flies were tog number exactly a mth today. Hope well haf many more mths to come,0
Is ur paper today in e morn or aft?,0
Not heard from U number a while. Call number rude chat private line number to cum. Wan number C pics of me gettin shagged then text PIX to number number End send STOP number SAM xxx,1
Yeah I am so Ill leave maybe number ish?,0
Just sent you an email to an address with incomm in it is that right?,0
Yup no more already Thanx number printing n handing it up.,0
Don know he is watching film in computer,0
Well if Im that desperate Ill just call armand again,0
Anyway seriously hit me up when youre back because otherwise I have to light up with armand and he always has shit andor is vomiting,0
Neva mind its ok,0
Sac needs to carry on emoji,0
Thinkin about someone is all good. No drugs for that,0
No no emoji this is kallis home ground.amla home town is durban emoji,0
Urgent! call number from Landline. Your complimentary number Tenerife Holiday or currency number number cash await collection SAE TCs BOX number HP number number YF number ppm number,1
Come to me slave. Your doing it again Going into your shell and unconsciously avoiding me You are making me unhappy emoji,0
Call me when u finish then i come n pick u.,0
Take us out shopping and Mark will distract Isaiah.D,0
Hi frnd which is best way to avoid missunderstding wit our beloved ones?,0
That day say cut ur hair at paragon is it called hair sense? Do noe how much is a hair cut?,0
In work now. Going have in few min.,0
Indians r poor but India is not a poor country. Says one of the swiss bank directors. He says that ltgt lac crore of Indian money is deposited in swiss banks which can be used for taxless budget for ltgt yrs. Can give ltgt crore jobs to all Indians. From any village to Delhi number lane roads. Forever free power suply to more than ltgt social projects. Every citizen can get monthly ltgt for ltgt yrs. No need of World Bank amp IMF loan. Think how our money is blocked by rich politicians. We have full rights against corrupt politicians. Itna forward karo ki pura INDIA padhe.g.m.,0
Ok be careful ! Dont text and drive !,0
Playin space poker u?,0
When you came to hostel.,0
Wat time wan today?,0
I will cme i want to go to hos number morow. After that i wil cme. This what i got from her dear what to do. She didnt say any time,0
Wait ltgt min,0
Quite late lar Ard number anyway i wun b drivin,0
I need an number th but Im off campus atm could I pick up in an hour or two?,0
whatever im pretty pissed off.,0
The house is on the water with a dock a boat rolled up with a newscaster who dabbles in jazz flute behind the wheel,0
Sorry in meeting Ill call you later,0
Yar but they say got some error.,0
I sent them. Do you like?,0
Ya just telling abt tht incident,0
Haha my legs and neck are killing me and my amigos are hoping to end the night with a burn think I could swing by in like an hour?,0
I tot u outside cos darren say u come shopping. Of course we nice wat. We jus went sim lim look at mp number player.,0
Petey boy whereare you me and all your friendsare in theKingshead come down if you canlove Nic,0
No. number Nokia Tone number ur mob every week! Just txt NOK to number number st Tone FREE ! so get txtin now and tell ur friends. number ptone. number reply HL number info,1
Went to ganesh dress shop,0
lyricalladie( number F) is inviting you to be her friend. Reply YES number or NO number See her: www.SMS.acuhmmross STOP? Send STOP FRND to number,1
Call me da i am waiting for your call.,0
Oh really?? Did you make it on air? Whats your talent?,0
You will go to walmart. I.ll stay.,0
number free text msgs. Just text ok to number and well credit your account,1
Doing nothing then u not having dinner w us?,0
Call from number tells u number call number to claim currency number prize. U have number enter all ur mobile personal details the prompts. Careful!,1
Sun ah Thk mayb can if dun have anythin on Thk have to book e lesson E pilates is at orchard mrt u noe hor,0
Tmr timin still da same wat cos i got lesson until number,0
Im done oredi,0
Are you plans with your family set in stone ?,0
number marrow only. Wed at ltgt to number aha.,0
Wat doing now?,0
Please ask mummy to call father,0
Still in customer place,0
Then just eat a shit and wait for ur monkey face bitch . U asshole,0
its really getting me down just hanging around.,0
TMobile customer you may now claim your FREE CAMERA PHONE upgrade a pay go sim card for your loyalty. Call on number number number Offer ends number thFeb.TCs apply,1
Thank god they are in bed!,0
Thanks for your subscription to Ringtone UK your mobile will be charged currency number month Please confirm by replying YES or NO. If you reply NO you will not be charged,1
And now electricity just went out fml.,0
Hurry up Ive been weeddeficient for like three days,0
Hello hun how ru? Its here by the way. Im good. Been on number dates with that guy i met in walkabout so far. We have to meet up soon. Hows everyone else?,0
Fuck babe I miss you sooooo much !! I wish you were here to sleep with me My bed is so lonely I go now to sleep To dream of you my love,0
We still on for tonight?,0
Could you not read me my Love ? I answered you,0
I dont. Can you send it to me. Plus hows mode.,0
Sorry Ill call later,0
Thats cool. I want to please you,0
Dear got train and seat mine lower seat,0
I wan but too early lei Me outside now wun b home so early Neva mind then,0
number Congratulations in this weeks competition draw u have won the currency number prize to claim just call number b number TCsstop SMS number Over number only number ppm,1
Do well emoji all will for little time. Thing of good times ahead:,0
o turns out i had stereo love on mi phone under the unknown album.,0
I remet alex nichols from middle school and it turns out hes dealing!,0
number number Do you want a New Nokia number i colour phone DeliveredTomorrow? With number free minutes to any mobile number free texts Free Camcorder reply or call number,1
How do you guys go to see movies on your side.,0
I can ask around but theres not a lot in terms of mids up here,0
hiya hows it going in sunny africa? hope u r avin a good time. give that big old silver back a big kiss from me.,0
Ok lor,0
FREE UNLIMITED HARDCORE PORN direct number your mobile Txt PORN to number get FREE access for number hrs then chrgd number p per day txt Stop number exit. This msg is free,1
Thats cool Ill come by like ltgt ish,0
SORRY IM STIL FUCKED AFTER LAST NITE WENT TOBED AT number GOT UP number WORK AT number,0
Lara said she can loan me ltgt .,0
Havent seen my facebook huh? Lol!,0
Someone has conacted our dating service and entered your phone because they fancy you!To find out who it is call from landline number PoBox number n number tf number,1
Get the door Im here,0
FRAN I DECIDED number GO N E WAY IM COMPLETELY BROKE AN KNACKERED I GOT UP BOUT number C U number MRW LOVE JANX P.S THIS IS MY DADS FONE NO CREDIT,0
Hi babe its me thanks for coming even though it didnt go that well!i just wanted my bed! Hope to see you soon love and kisses xxx,0
Hope youre not having too much fun without me!! see u tomorrow love jess x,0
Yup song bro. No creative. Neva test quality. He said check review online.,0
OH MR SHEFFIELD! You wanna play THAT game okay. Youre the boss and Im the nanny. You give me a raise and Ill give YOU one!!,0
Whats ur pin?,0
emoji yeah! Lol. Luckily i didnt have a starring role like you!,0
Perhaps is much easy give your account identification so i will tomorrow at UNI,0
Aight fuck it Ill get it later,0
Btw regarding that we should really try to see if anyone else can be our number th guy before we commit to a random dude,0
Dear Uve been invited to XCHAT. This is our final attempt to contact u! Txt CHAT to number,1
Just chill for another number hrs. If you could sleep the pain is not a surgical emergency so see how it unfolds. Okay,0
I meant middle left or right?,0
Yeah I think my usual guys still passed out from last night if you get ahold of anybody let me know and Ill throw down,0
Wah lucky man Then can save money Hee,0
K can I pick up another number th when youre done?,0
Actually getting ready to leave the house.,0
MY NEW YEARS EVE WAS OK. I WENT TO A PARTY WITH MY BOYFRIEND. WHO IS THIS SI THEN HEY,0
Asking do u knw them or nt? May be ur frnds or classmates?,0
I shall book chez jules for half eight if thats ok with you?,0
Sun cant come to earth but send luv as rays. cloud cant come to river but send luv as rain. I cant come to meet U but can send my care as msg to U. Gud evng,0
Havent shopping now lor i juz arrive only,0
Is xy in ur car when u picking me up?,0
Carlos says hell be at mu in ltgt minutes,0
You call him and tell now infront of them. Call him now.,0
Sent me de webadres for geting salary slip,0
httptms. widelive.comindex. wml?id number ad number a number firsttrueC C Ringtone,1
Yup ive finished c there,0
Near kalainar tv office.thenampet,0
Sorry about earlier. Putting out fires.Are you around to talk after number ? Or do you actually have a life lol!,0
You said to me before i went back to bed that you cant sleep for anything.,0
Urgent! Please call number from your landline your complimentary number Lux Costa Del Sol holiday or currency number CASH await collection. ppm number SAE TCs James number EH number RR,1
Or better still can you catch her and let ask her if she can sell ltgt for me.,0
number mths half price Orange line rental latest camera phones number FREE. Had your phone number mths ? Call MobilesDirect free on number to update now! or number stoptxt,1
number FREE for number st week! No number Nokia tone number ur mob every week just txt NOKIA to number Get txting and tell ur mates www.getzed.co.uk POBox number W number number WQ norm number ptone number,1
I dont know oh. Hopefully this month.,0
Short But Cute : Be a good person but dont try to prove Gud mrng,0
Okay. No no just shining on. That was meant to be signing but that sounds better.,0
Haha mayb ure rite U know me well. Da feeling of being liked by someone is gd lor. U faster go find one then all gals in our group attached liao.,0
Can not use foreign stamps in this country. Good lecture .,0
Haha Sounds crazy dunno can tahan anot,0
Whenwhere do I pick you up,0
