text,label
Shall I bring us a bottle of wine to keep us amused? Only joking! Ill bring one anyway,0
sure but make sure he knows we aint smokin yet,0
Haha Yup hopefully we will lose a few kg by mon. after hip hop can go orchard and weigh again,0
I dont know ask to my brother. Nothing problem some thing that. Just i told .,0
Watching ajith film ah?,0
Whenre you guys getting back? G said you were thinking about not staying for mcr,0
Getting tickets number walsall tue number th march. My mate is getting me them on sat. ill pay my treat. Want number go. Txt bak .Terry,0
Mmmmm I loved waking to your words this morning ! I miss you too my Love. I hope your day goes well and you are happy. I wait for us to be together again,0
I like to think theres always the possibility of being in a pub later.,0
Why are u up so early?,0
Its that time of the week again ryan,0
He neva grumble but i sad lor Hee Buy tmr lor aft lunch. But we still meetin number lunch tmr a not. Neva hear fr them lei. got a lot of work ar?,0
Ah you see. You have to be in the lingo. I will let you know wot on earth it is when has finished making it!,0
Ok lor Or u wan me go look number u?,0
See the forwarding message for proof,0
Huh Hyde park not in mel ah opps got confused Anyway if tts e best choice den we juz have to take it,0
What is important is that you prevent dehydration by giving her enough fluids,0
Message Important information for O number user. Today is your lucky day! number find out why log onto http:www.urawinner.com there is a fantastic surprise awaiting you,1
LOL Have you made plans for new years?,0
This girl does not stay in bed. This girl doesnt need recovery time. Id rather pass out while having fun then be cooped up in bed,0
K still are you loving me.,0
Well i know Z will take care of me. So no worries.,0
Last Chance! Claim ur currency number worth of discount vouchers today! Text SHOP to number now! SavaMob offers mobile! T Cs SavaMob POBOX number M number UZ. currency number Sub. number,1
Im sick !! Im needy !! I want you !! pouts stomps feet Where are you ?! pouts stomps feet I want my slave !! I want him now !!,0
For ur chance to win a currency number wkly shopping spree TXT: SHOP to number TsCs www.txt number shop.com custcare number number x number pwk,1
You still at the game?,0
Sorry chikku my cell got some problem thts y i was nt able to reply u or msg u,0
Having lunch emoji you are not in online?why?,0
thesmszone.com lets you send free anonymous and masked messages im sending this message from there do you see the potential for abuse???,1
Please protect yourself from ethreats. SIB never asks for sensitive information like PasswordsATMSMS PIN thru email. Never share your password with anybody.,0
Miss call miss call khelate kintu opponenter miss call dhorte lage. Thats d rule. One with great phone receiving quality wins.,0
Had your contract mobile number Mnths? Latest Motorola Nokia etc. all FREE! Double Mins Text on Orange tariffs. TEXT YES for callback no to remove from records,1
Is it your yahoo boys that bring in the perf? Or legal.,0
Maybe?! Say hi to and find out if got his card. Great escape or wetherspoons?,0
Nope. Since ayo travelled he has forgotten his guy,0
Pls tell nelson that the bbs are no longer comin. The money i was expecting aint coming,0
Why is that princess? I bet the brothas are all chasing you!,0
Dont worry. I guess hes busy.,0
Have you seen whos back at Holby?!,0
Im not driving Raining! Then ill get caught at e mrt station lor.,0
Fffff. Can you text kadeem or are you too far gone,0
Aiyo U always c our ex one I dunno abt mei she haven reply First time u reply so fast Y so lucky not workin huh got bao by ur sugardad ah gee,0
I do know what u mean is the king of not havin credit! Im goin number bed now. Night night sweet! Only number more sleep!,0
Coffee cake i guess,0
Ok enjoy . R u there in home.,0
(No promises on when though havent even gotten dinner yet),0
Thanks for being there for me just to talk to on saturday. You are very dear to me. I cherish having you as a brother and role model.,0
Im home my love If your still awake loving kiss,0
Excellent! Are you ready to moan and scream in ecstasy?,0
Also remember the beads dont come off. Ever.,0
Lol no. U can trust me.,0
Jay is snickering and tells me that x is totally fucking up the chords as we speak,0
Yoyyooo u know how to change permissions for a drive in mac. My usb flash drive,0
Dunno lei I might b eatin wif my frens If wan to eat then i wait number lar,0
When are you guys leaving?,0
Where is that one day training emoji,0
number st wk FREE! Gr number tones str number number u each wk. Txt NOKIA ON to number for Classic Nokia tones or HIT ON to number for Polys. Nokia number p Poly number p number,1
No need to ke qi too bored izzit y suddenly thk of this,0
Haha better late than ever any way I could swing by?,0
Can do lor,0
Yo call me when you get the chance a friend of mine wanted me to ask you about a big order,0
FRNDSHIP is like a needle of a clock. Though V r in d same clock V r nt able number met. Evn if V meetitz only number few seconds. Bt V alwys stay conected. Gud number t),0
You didnt complete your gist oh.,0
First answer my question.,0
Are you free now?can i call now?,0
URGENT! Your Mobile No. was awarded currency number Bonus Caller Prize on number number number This is our final try to contact U! Call from Landline number BOX number WR number C number PPM,1
Why dont you wait til at least wednesday to see if you get your .,0
Will purchase d stuff today and mail to you. Do you have a po box number?,0
Gud gud k chikku tke care sleep well gud nyt,0
Probably not Im almost out of gas and I get some cash tomorrow,0
Hi dude hw r u da realy mising u today,0
We made it! Eta at taunton is number : number as planned hope thats still okday?! Good to see you! :xx,0
I (Career Tel) have added u as a contact on INDYAROCKS.COM to send FREE SMS. To remove from phonebook sms NO to ltgt,0
Peteis this your phone still? Its Jenny from college and Leanne.what are you up to now? emoji,0
I am on the way to tirupur.,0
Shall i ask one thing if you dont mistake me.,0
I want to send something that can sell fast. ltgt k is not easy money.,0
Yeah thats the impression I got,0
Have you heard from this week?,0
Yup I havent been there before You want to go for the yoga? I can call up to book,0
Tmrw. Im finishing number doors,0
Ok ill tell the company,0
Living is very simple Loving is also simple Laughing is too simple Winning is tooo simple But Being SIMPLE is very difficult ) emoji,0
Mystery solved! Just opened my email and hes sent me another batch! Isnt he a sweetie,0
Oh gei. That happend to me in tron. Maybe ill dl it in number d when its out,0
Ive got it down to a tea. not sure which flavour,0
Then any special there?,0
Where wuld I be without my baby? The thought alone mite break me and I dont wanna go crazy but everyboy needs his lady xxxxxxxx,0
Hello. No news on job they are making me wait a fifth week! Yeah im up for some woozles and weasels In exeter still but be home about number,0
Yes i have. So thats why u texted. Pshew missing you so much,0
Nothing i got msg frm tht unknown no,0
Each Moment in a dayhas its own valueMorning brings hopeafternoon brings faithEvening brings luvNight brings restWish u find them all today.Good Morning,0
Wot is u up number then bitch?,0
Just do what ever is easier for you,0
Did u download the fring app?,0
R going number todays meeting?,0
I am in a marriage function,0
Then we gotta do it after that,0
Then she dun believe wat?,0
Say this slowly.? GODI LOVE YOU amp I NEED YOUCLEAN MY HEART WITH YOUR BLOOD.Send this to Ten special people amp u c miracle tomorrow do itplspls do it,0
Jordan got voted out last nite!,0
Welcome to UKmobiledate this msg is FREE giving you free calling to number Future mgs billed at number p daily. To cancel send go stop to number,1
I don know account details i will ask my mom and send you.my mom is out of reach now.,0
Cant. I feel nauseous. Im so pissed. I didnt eat any sweets all week cause today I was planning to pig out. I was dieting all week. And now Im not hungry :,0
I wonder if youll get this text?,0
Im e person whos doing e sms survey,0
K come to nordstrom when youre done,0
Guy no flash me now. If you go call me call me. How madam. Take care oh.,0
How long does applebees fucking take,0
CERI U REBEL! SWEET DREAMZ ME LITTLE BUDDY!! C YA number MORO! WHO NEEDS BLOKES,0
Ok finishing soon?,0
Hungry gay guys feeling hungry and up number it now. Call number just number pmin. To stop texts call number ( number pmin),1
Am in gobi arts college,0
I like cheap! But im happy to splash out on the wine if it makes you feel better,0
Night has ended for another day morning has come in a special way. May you smile like the sunny rays and leaves your worries at the blue blue bay.,0
Customer service annoncement. You have a New Years delivery waiting for you. Please call number now to arrange delivery,1
Frnd s not juz a word not merely a relationship its a silent promise which says I will be with YOU Wherevr Whenevr Forevr Gudnyt dear,0
Text PASS to number to collect your polyphonic ringtones. Normal gprs charges apply only. Enjoy your tones,1
How is it possible to teach you. And where.,0
Reading gud habit Nan bari hudgi yorge pataistha ertini kano emoji,0
Email AlertFrom: Jeri StewartSize: number KBSubject: Lowcost prescripiton drvgsTo listen to email call number,1
MMM Fuck . Merry Christmas to me,0
Hi Dear Call me its urgnt. I dont know whats your problem. You dont want to work or if you have any other problem at least tell me. Wating for your reply.,0
Hi. Wk been ok on hols now! Yes on for a bit of a run. Forgot that i have hairdressers appointment at four so need to get home n shower beforehand. Does that cause prob for u?,0
Will it help if we propose going back again tomorrow,0
Ya i knw u vl giv its ok thanks kano anyway enjoy wit ur family wit number st salary emoji ),0
Were done,0
emoji but your not here .,0
Actually I decided I was too hungry so I havent left yet :V,0
Only just got this message not ignoring you. Yes i was. Shopping that is,0
Nope i waiting in sch number daddy,0
Mind blastin No more Tsunamis will occur from now on Rajnikant stopped swimming in Indian Ocean :D,0
Yeah hopefully if tyler cant do it I could maybe ask around a bit,0
we tried to contact you re your response to our offer of a new nokia fone and camcorder hit reply or call number for delivery,1
Amazing : If you rearrange these letters it gives the same meaning Dormitory Dirty room Astronomer Moon starer The eyes They see Election results Lies lets recount Motherinlaw Woman Hitler Eleven plus two Twelve plus one Its Amazing ! emoji,0
Went to pay rent. So i had to go to the bank to authorise the payment.,0
BABE !!! I miiiiiiissssssssss you ! I need you !!! I crave you !!! emoji Geeee Im so sad without you babe I love you,0
We currently have a message awaiting your collection. To collect your message just call number,1
Nothing will ever be easy. But dont be looking for a reason not to take a risk on life and love,0
But am going to college pa. What to do. are else ill come there it self. Pa.,0
Boo what time u get out? U were supposed to take me shopping today. emoji,0
NEFT Transaction with reference number ltgt for Rs. ltDECIMALgt has been credited to the beneficiary account on ltgt at ltTIMEgt : ltgt,0
We know TAJ MAHAL as symbol of love. But the other lesser known facts number Mumtaz was Shahjahans number th wife out of his number wifes. number Shahjahan killed Mumtazs husband to marry her. number Mumtaz died in her ltgt th delivery. number He then married Mumtazs sister. Question arises where the Hell is the LOVE?: The Great Hari,0
G wants to know where the fuck you are,0
Long after I quit. I get on only like number minutes a day as it is.,0
My mobile number.pls sms ur mail id.convey regards to achanamma.Rakhesh.Qatar,0
number and number are premium phone services call number,1
Congratulations U can claim number VIP row A Tickets number C Blu in concert in November or Blu gift guaranteed Call number to claim TSCs www.smsco.net cost currency number max,1
Congratulations ur awarded either a yrs supply of CDs from Virgin Records or a Mystery Gift GUARANTEED Call number TsCs www.smsco.net currency number pm approx number mins,1
Hey now am free you can call me.,0
HEY KATE HOPE UR OK WILL GIVE U A BUZ WEDLUNCH. GO OUTSOMEWHERE number ADRINK IN TOWN CUD GO number WATERSHD number A BIT? PPL FROMWRK WILL BTHERE. LOVE PETEXXX.,0
Im still pretty weak today Bad day ?,0
Hey ! I want you ! I crave you ! I miss you ! I need you ! I love you Ahmad Saeed al Hallaq,0
Anything lor U decide,0
ELLO BABE U OK?,0
Itll be tough but Ill do what I have to,0
I was wondering if it would be okay for you to call uncle john and let him know that things are not the same in nigeria as they r here. That ltgt dollars is number years sent and that you know its a strain but i plan to pay back every dime he gives. Every dime so for me to expect anything from you is not practical. Something like that.,0
Hi its Kate it was lovely to see you tonight and ill phone you tomorrow. I got to sing and a guy gave me his card! xxx,0
U are subscribed to the best Mobile Content Service in the UK for currency number per number days until you send STOP to number Helpline number,1
My friends use to call the same.,0
Tick tick tick . Where are you ? I could die of loneliness you know ! pouts stomps feet I need you,0
Ya im referin to meis ex wat No ah waitin number u to treat somebody shld b rich liao So gd den u dun have to work frm tmr onwards,0
How much i gave to you. Morning.,0
eatin later but im eatin wif my frens now lei going home first?,0
Smith waste da.i wanna gayle.,0
Dunno my dad said he coming home number bring us out number lunch. Yup i go w u lor. I call u when i reach school lor,0
I thk number lor. But dunno can get tickets a not. Wat u doing now?,0
I am getting threats from your sales executive Shifad as i raised complaint against him. Its an official message.,0
Great. I was getting worried about you. Just know that a wonderful and caring person like you will have only the best in life. Know that u r wonderful and Gods love is yours.,0
Yup its at paragon I havent decided whether number cut yet Hee,0
This phone has the weirdest auto correct.,0
Ok. No wahala. Just remember that a friend in need,0
Youre gonna have to be way more specific than that,0
Hey darlin i can pick u up at college if u tell me wen where number mt love Pete xx,0
Forwarded from number Hi this is your Mailbox Messaging SMS alert. You have number messages. You have number matches. Please call back on number to retrieve your messages and matches,1
Die Now i have e toot fringe again,0
dating:i have had two of these. Only started after i sent a text to talk sport radio last week. Any connection do you think or coincidence?,1
sexy sexy cum and text me im wet and warm and ready for some porn! u up for some fun? THIS MSG IS FREE RECD MSGS number P INC VAT number CANCEL TEXT STOP,1
Friends that u can stay on fb chat with,0
December only! Had your mobile number mths? You are entitled to update to the latest colour camera mobile for Free! Call The Mobile Update Co FREE on number,1
Aft i finish my lunch then i go str down lor. Ard number smth lor. U finish ur lunch already?,0
haha but no money leh Later got to go for tuition Haha and looking for empty slots for driving lessons,0
Haha Really oh no How? Then will they deduct your lesson tmr?,0
R u meeting da ge at nite tmr?,0
K go and sleep well. Take rest emoji .,0
Which is weird because I know I had it at one point,0
I have lost number kilos as of today!,0
Y lei?,0
I am great princess! What are you thinking about me? emoji,0
Hey! Congrats number u number id luv number but ive had number go home!,0
Ok i will tell her to stay out. Yeah its been tough but we are optimistic things will improve this month.,0
Happy New year my dear brother. I really do miss you. Just got your number and decided to send you this text wishing you only happiness. Abiola,0
Ok but knackered. Just came home and went to sleep! Not good at this full time work lark.,0
Still i have not checked it da. . .,0
No problem. How are you doing?,0
Dear Voucher holder Have your next meal on us. Use the following link on your pc number enjoy a number number number dining experiencehttp:www.vouch number me.cometlpdining.asp,1
Yeah. I got a list with only u and Joanna if Im feeling really anti social,0
If you dont your prize will go to another customer. TC at www.tc.biz number number pmin Polo Ltd Suite number London W number J number HL Please call back if busy,1
It so happens that there r number waxsto do wat you want. She can come and ill get her medical insurance. And shell be able to deliver and have basic care. Im currently shopping for the right medical insurance for her. So just give me til friday morning. Thats when i.ll see the major person that can guide me to the right insurance.,0
Dont worry is easy once have ingredients!,0
K will do addie amp I are doing some art so Ill be here when you get home,0
Then i buy.,0
The wine is flowing and im i have nevering,0
Wanna do some art?! :D,0
Aiya we discuss later lar Pick up at number is it?,0
Camera You are awarded a SiPix Digital Camera! call number fromm landline. Delivery within number days,1
Tired. I havent slept well the past few nights.,0
Guess what! Somebody you know secretly fancies you! Wanna find out who it is? Give us a call on number From Landline DATEBox number EssexCM number XN number pmin number,1
Will be september by then!,0
At home also.,0
Urgent! Please call number from a landline. currency number cash or a number holiday await collection. T Cs SAE PO Box number M number XY. number,1
And I dont plan on staying the night but I prolly wont be back til late,0
Thats what I love to hear :V see you sundayish then,0
I am lateso call you tomorrow morning.take care sweet dreams .u and me ummifying bye.,0
Want the latest Video handset? number anytime any network mins? Half price line rental? Reply or call number for delivery tomorrow,1
Yeah imma come over cause jay wants to do some drugs,0
K tell me anything about you.,0
Then dun wear jeans lor,0
SIX chances to win CASH! From number to number number pounds txt CSH number and send to number Cost number pday number days number TsandCs apply Reply HL number info,1
Haha Hope can hear the receipt sound Gd luck!,0
Noice. Text me when youre here,0
Can U get number phone NOW? I wanna chat number set up meet Call me NOW on number U can cum here number moro Luv JANE xx Calls currency number minmoremobsEMSPOBox number PO number WA,1
Please give it number or i will pick it up on Tuesday evening about number if that is ok.,0
i dnt wnt to tlk wid u,0
I called but no one pick up e phone. I ask both of them already they said ok.,0
No am working on the ringing u thing but have whole houseful of screaming brats so am pulling my hair out! Loving u,0
Whats nannys address?,0
number tacos number rajas burrito right?,0
number FREERingtone!Reply REAL,1
U really pig leh sleep so much. My dad wake me up at number smth number eat lunch today.,0
Rose needs water season needs change poet needs imagination My phone needs ur sms and i need ur lovely frndship forever .,0
Hope you are not scared!,0
Come to mu were sorting out our narcotics situation,0
Geeeee I love you so much I can barely stand it,0
I can make lasagna for you vodka,0
Happy birthday May u find ur prince charming soon n dun work too hard,0
Dare i ask Any luck with sorting out the car?,0
Goodmorning today i am late for number hrs. Because of back pain.,0
Thx. All will be well in a few months,0
FREEMSG: Our records indicate you may be entitled to number pounds for the Accident you had. To claim for free reply with YES to this msg. To opt out text STOP,1
Fantasy Football is back on your TV. Go to Sky Gamestar on Sky Active and play currency number k Dream Team. Scoring starts on Saturday so register now!SKY OPT OUT to number,1
U ned to convince him tht its not possible witot hurting his feeling its the main,0
Yep. I do like the pink furniture tho.,0
Spook up your mob with a Halloween collection of a logo pic message plus a free eerie tone txt CARD SPOOK to number zed number p per logopic,1
So li hai Me bored now da lecturer repeating last weeks stuff waste time,0
Ok lor Sony ericsson salesman I ask shuhui then she say quite gd number use so i considering,0
number XMAS iscoming ur awarded either currency number CD gift vouchers free entry number r currency number weekly draw txt MUSIC to number TnC,1
In The Simpsons Movie released in July number name the band that died at the start of the film? AGreen Day BBlue Day CRed Day. (Send A B or C),1
Dude got a haircut. Now its breezy up there,0
K my roommate also wants a dubsack and another friend may also want some so plan on bringing extra Ill tell you when they know for sure,0
Ya had just now.onion roast.,0
I think you should go the honesty road. Call the bank tomorrow. Its the tough decisions that make us great people.,0
wiskey Brandy Rum Gin Beer Vodka Scotch Shampain Wine KUDIyarasu dhina vaazhthukkal.,0
Oh yes I can speak txt number u no! Hmm. Did u get email?,0
Yo theres no class tmrw right?,0
So lets make it saturday or monday as per convenience.,0
Ok Ur typical reply,0
Id onluy matters when getting on from offcampus,0
Are you staying in town ?,0
Oh k k emoji but he is not a big hitter.anyway good,0
Oi when you gonna ring,0
says the ltgt year old with a man and money. Im down to my last ltgt . Still waiting for that check.,0
No problem with the renewal. I.ll do it right away but i dont know his details.,0
FREE for number st week! No number Nokia tone number ur mobile every week just txt NOKIA to number Get txting and tell ur mates. www.getzed.co.uk POBox number W number WQ number norm number ptone,1
I got a call from a landline number. . . I am asked to come to anna nagar . . . I will go in the afternoon,0
Ha. You dont know either. I did a a clever but simple thing with pears the other day perfect for christmas.,0
Idk. You keep saying that youre not but since he moved we keep butting heads over freedom vs. responsibility. And im tired. I have so much other shit to deal with that im barely keeping myself together once this gets added to it.,0
No probably ltgt .,0
I am taking half day leave bec i am not well,0
Its sarcasm .nt scarcasim,0
K emoji k emoji what are detail you want to transfer?acc no enough?,0
Heehee that was so funny tho,0
Happy birthday May all ur dreams come true,0
Oh yeah! And my diet just flew out the window,0
number number p number Alfie Moons Children in Need song on ur mob. Tell ur m number s. Txt TONE CHARITY to number for nokias or POLY CHARITY for polys :zed number profit number charity,1
That is wondarfull song,0
Then. You are eldest know.,0
YOU number are guaranteed the latests Nokia Phone a number GB iPod MP number player or a currency number prize! Txt word:COLLECT to No: number ! TCLLC NYUSA number pMt msgrcvd number,1
You are a big chic. Common. Declare,0
How? Izzit still raining?,0
I.ll always be there even if its just in spirit. I.ll get a bb soon. Just trying to be sure i need it.,0
I just saw ron burgundy captaining a party boat so yeah,0
ZOE IT JUST HIT ME number IM FUCKING SHITIN MYSELF IL DEFO TRY MY HARDEST number CUM number MOROW LUV U MILLIONS LEKDOG,0
Thankyou so much for the call. I appreciate your care.,0
FREE RING TONE just text POLYS to number Then every week get a new tone. number yrs only currency number wk.,1
Do you want a New Nokia number i colour phone DeliveredTomorrow? With number free minutes to any mobile number free texts Free Camcorder reply or call number,1
U have a Secret Admirer who is looking number make contact with Ufind out who they Rreveal who thinks UR so specialcall on number stopsms number ppm,1
NO GIFTS!! You trying to get me to throw myself off a cliff or something?,0
Hi emoji did you asked to waheeda fathima about leave?,0
Y de asking like this.,0
Not able to do anything.,0
Hey tmr meet at bugis number ?,0
Discussed with your mother ah?,0
I.ll give her once i have it. Plus she said grinule greet you whenever we speak,0
Normally i use to drink more water daily emoji,0
Did u got that persons story,0
SMS AUCTION A BRAND NEW Nokia number is up number auction today! Auction is FREE number join take part! Txt NOKIA to number now!,1
Yeah we can probably swing by once my roommate finishes up with his girl,0
Hey leave it. not a big deal emoji take care.,0
alright babe justthought id sayhey! how u doin?nearly the endof me wk offdam nevamind!We will have number Hook up sn if uwant m number ? loveJen x.,0
Yes princess. Toledo.,0
ready then call me,0
Jamster! To get your free wallpaper text HEART to number now! TC apply. number only. Need Help? Call number,1
Hi Jon Pete here Ive bin number Spain recently hav sum dinero left Bill said u or ur rents mayb interested in it I hav number number pes so around currency number tb James.,0
So when you gonna get rimac access,0
Get number Lions England tone reply lionm number mono or lionp number poly. number more go number www.ringtones.co.uk the original n best. Tones number GBP network operator rates apply,1
Just re read it and I have no shame but tell me how he takes it and if he runs I will blame u number ever!! Not really number ever just a long time,0
It could work well reach a consensus at the next meeting,0
ME number BABE I FEEL THE SAME LETS JUST number GET ABOUT ITBOTH TRY CHEER UPNOT FIT SOO MUCHXXLOVE U LOCAXX,0
called dad oredi,0
Change again Its e one next to escalator,0
I think i am disturbing her da,0
Ok both our days. So what are you making for dinner tonite? Am I invited?,0
Im so in love with you. Im excited each day i spend with you. You make me so happy.,0
I prefer my free days Tues wed fri oso can ask those workin lor,0
It only does simple arithmetic not percentages.,0
