text,label
Thanx u darlin!im cool thanx. A few bday drinks number nite. number morrow off! Take care c u soon.xxx,0
Tonight? Yeah Id be down for that,0
Yup From what i remb I think should be can book,0
Yeah Ill leave in a couple minutes amp let you know when I get to mu,0
Give her something to drink if she takes it and doesnt vomit then you her temp might drop. If she unmits however let me know.,0
You getting back any time soon?,0
Okay We wait ah,0
Dont b floppy b snappy happy! Only gay chat service with photo upload call number ( number pmin). number stop our texts call number,1
Wot about on wed nite I am number then but only til number !,0
So that takes away some money worries,0
In fact when do you leave? I think addie goes back to school tues or wed,0
Allo! We have braved the buses and taken on the trains and triumphed. I mean were in bham. Have a jolly good rest of week,0
I can send you a pic if you like emoji,0
Hiya do u like the hlday pics looked horrible in them so took mo out! Hows the camp Amrca thing? Speak soon Serena emoji,0
Boo Im on my way to my moms. Shes making tortilla soup. Yummmm,0
We have new local dates in your area Lots of new people registered in YOUR AREA. Reply DATE to start now! number only www.flirtparty.us REPLYS number,1
I sent your maga that money yesterday oh.,0
And hes apparently bffs with carly quick now,0
Yes princess! I want to please you every night. Your wish is my command,0
Sexy Singles are waiting for you! Text your AGE followed by your GENDER as wither M or F E.G number F. For gay men text your AGE followed by a G. e.g number G.,1
I wonder if your phone battery went dead ? I had to tell you I love you babe,0
Boy you best get yo ass out here quick,0
Oh yeah clearly its my fault,0
Hi missed your Call and my mumHas beendropping red wine all over theplace! what is your adress?,0
Ok.ok ok then whats ur todays plan,0
YOUR CHANCE TO BE ON A REALITY FANTASY SHOW call now number Just number p per min NTT Ltd PO Box number Croydon CR number number WB number is a national rate call.,1
You also didnt get na hi hi hi hi hi,0
No way Im going back there!,0
Thanks Ill keep that in mind,0
Yar i wanted number scold u yest but late already I where got zhong se qing you? If u ask me b number he ask me then ill go out w u all lor. N u still can act so real.,0
Hi good mornin Thanku wish u d same,0
Idea will soon get converted to live emoji,0
U call me alter at number ok.,0
I have to take exam with in march number,0
Hes an adult and would learn from the experience. Theres no real danger. I just dont like peeps using drugs they dont need. But no comment,0
Im very happy for you babe ! Woo hoo party on dude!,0
Wishing you a wonderful week.,0
I am back. Bit long cos of accident on a number Had to divert via wadebridge.I had a brilliant weekend thanks. Speak soon. Lots of love,0
Yup im still having coffee wif my frens My fren drove shell give me a lift,0
Just gettin a bit arty with my collages at the mo well tryin number ne way! Got a roast in a min lovely i shall enjoy that!,0
Love it! The girls at the office may wonder why you are smiling but sore,0
How are you. Wish you a great semester,0
K k. emoji congratulation,0
I cant wait for cornwall. Hope tonight isnt too bad as well but its rock night shite. Anyway im going for a kip now have a good night. Speak to you soon.,0
Do you want a new video handset? number anytime any network mins? Half Price Line Rental? Camcorder? Reply or call number for delivery tomorrow,1
Ok good then i later come find C lucky i told to go earlier Later pple take finish no more again,0
Then why you not responding,0
Do we have any spare power supplies,0
Macha dont feel upset.i can assume your mindset.believe me one evening with me and i have some wonderful plans for both of us.LET LIFE BEGIN AGAIN.call me anytime,0
Audrie lousy autocorrect,0
In which place i can get rooms cheap emoji,0
No my mum went number dentist.,0
Went fast asleep dear.take care.,0
I enjoy watching and playing football and basketball. Anything outdoors. And you?,0
Im back lemme know when youre ready,0
Carlos is taking his sweet time as usual so let me know when you and patty are donewant to smoke and Ill tell him to haul ass,0
HELLO PEACH! MY CAKE TASTS LUSH!,0
Ive told him that ive returned it. That should i re order it.,0
But Im on a diet. And I ate number too many slices of pizza yesterday. Ugh Im ALWAYS on a diet.,0
Lol alright i was thinkin that too haha,0
Did u turn on the heater? The heater was on and set to ltgt degrees.,0
Ok. Every night take a warm bath drink a cup of milk and youll see a work of magic. You still need to loose weight. Just so that you know,0
YEH I AM DEF UP number SOMETHING SATJUST GOT PAYED number DAY I HAVBEEN GIVEN A currency number PAY RISE number MY WORK HAVEBEEN MADE PRESCHOOLCOORDINATOR number I AM FEELINGOOD LUV,0
You are guaranteed the latest Nokia Phone a number GB iPod MP number player or a currency number prize! Txt word: COLLECT to No: number ! IBHltd LdnW number H number pMtmsgrcvd number,1
HARD BUT TRUE: How much you show amp express your love to someone .that much it will hurt when they leave you or you get seperated !??ud evening,0
Havent heard anything and hes not answering my texts so Im guessing he flaked. That said the jb is fantastic,0
The word Checkmate in chess comes from the Persian phrase Shah Maat which means the king is dead Goodmorning Have a good day emoji,0
HI DARLIN IVE JUST GOT BACK AND I HAD A REALLY NICE NIGHT AND THANKS SO MUCH FOR THE LIFT SEE U TOMORROW XXX,0
Hard LIVE number chat just number pmin. Choose your girl and connect LIVE. Call number now! Cheap Chat UKs biggest live service. VU BCM number WC number N number XX,1
A boy was late number home. His father: POWER OF FRNDSHIP,0
I wanted to ask to wait number me to finish lect. Cos my lect finishes in an hour anyway.,0
No plm i will come da. On the way.,0
Im cool ta luv but v.tired number cause i have been doin loads of planning all wk we have got our social services inspection at the nursery! Take care spk sn x.,0
Did either of you have any ideas? Do you know of anyplaces doing something?,0
Japanese Proverb: If one Can do it U too Can do it If none Can do itU must do it Indian version: If one Can do it LET HIM DO it If none Can do itLEAVE it!! And finally Kerala version: If one can do it Stop him doing it If none can do it Make a strike against it,0
I want to be there so i can kiss you and feel you next to me,0
Y dun cut too short leh. U dun like ah? She failed. Shes quite sad.,0
Yo you guys ever figure out how much we need for alcohol? Jay and I are trying to figure out how much we can safely spend on weed,0
PRIVATE! Your number Account Statement for number XXXXXX shows number unredeemed S. I. M. points. Call number Identifier Code: number Expires number number number,1
Youll not rcv any more msgs from the chat svc. For FREE Hardcore services text GO to: number If u get nothing u must Age Verify with yr network try again,1
Im reading the text i just sent you. Its meant to be a joke. So read it in that light,0
Wow. I never realized that you were so embarassed by your accomodations. I thought you liked it since i was doing the best i could and you always seemed so happy about the cave. Im sorry I didnt and dont have more to give. Im sorry i offered. Im sorry your room was so embarassing.,0
Good day to You too.Pray for me.Remove the teeth as its painful maintaining other stuff.,0
Easy mate guess the quick drink was bit ambitious.,0
Greetings me ! Consider yourself excused.,0
(I should add that I dont really care and if you cant I can at least get this dude to fuck off but hey your money if you want it),0
How did you find out in a way that didnt include all of these details,0
No drama Pls.i have had enough from you and family while i am struggling in the hot sun in a strange place.No reason why there should be an ego of not going IF NOT INVITED when actually its necessity to go.wait for very serious reppurcussions.,0
Er yep sure. Props?,0
Never blame a day in ur life. Good days give u happiness. Bad days give u experience. Both are essential in life! All are Gods blessings! good morning.:,0
Hasnt that been the pattern recently crap weekends?,0
Not really dude have no friends im afraid emoji,0
What he said is not the matter. My mind saying some other matter is there.,0
Just making dinner you ?,0
No da. . Vijay going to talk in jaya tv,0
Dad says hurry the hell up,0
Hi hope u r both ok he said he would text and he hasnt have u seen him let me down gently please,0
no i didnt mean to post it. I wrote it and like so many other times ive ritten stuff to you i let it sit there. it WAS what i was feeling at the time. I was angry. Before i left i hit send then stop. It wasnt there. I checked on my phone when i got to my car. It wasnt there. You said you didnt sleep you were bored. So why wouldnt THAT be the time to clean fold laundry etc.? At least make the bed?,0
Ugh hopefully the asus ppl dont randomly do a reformat.,0
No shit but I wasnt that surprised so I went and spent the evening with that french guy I met in town here and we fooled around a bit but I didnt let him fuck me,0
Argh why the fuck is nobody in town,0
Hi babe its Jordan how r u? Im home from abroad and lonely text me back if u wanna chat xxSP visionsms.com Text stop to stopCost number p number,1
He will you guys close?,0
So are you guys asking that i get that slippers again or its gone with last year,0
Noooooooo please. Last thing I need is stress. For once in your life be fair.,0
An excellent thought by a misundrstud frnd: I knw u hate me bt the day wen ull knw the truth ull hate urself emoji Gn emoji,0
Yo chad which gymnastics class do you wanna take? The site says Christians class is full,0
She is our sister She belongs number our family She is d hope of tomorrow Pray number herwho was fated number d Shoranur train incident. Lets hold our hands together amp fuelled by love amp concern prior number her grief amp pain. Pls join in dis chain amp pass it. STOP VIOLENCE AGAINST WOMEN.,0
That depends. How would you like to be treated? emoji,0
Wanna get laid number nite? Want real Dogging locations sent direct to ur mobile? Join the UKs largest Dogging Network. Txt PARK to number now! Nyt. ec number a. number lp currency number msg,1
One of the joys in lifeis waking up each daywith thoughts that somewhereSomeone cares enough tosend a warm morning greeting,0
Also wheres the piece,0
Want to send me a virtual hug? I need one,0
Be happy there. I will come after noon,0
Love you aathi love u lot,0
U horrible gal U knew dat i was going out wif him yest n u still come n ask me,0
Lol thats different. I dont go trying to find every real life photo you ever took.,0
Ok ill send you with in ltDECIMALgt ok.,0
Forgot you were working today! Wanna chat but things are ok so drop me a text when youre free bored etc and ill ring. Hope all is well nose essay and all xx,0
Aight do you still want to get money,0
Your pussy is perfect!,0
Youre right I have now that I think about it,0
I send the print outs da.,0
I place all ur points on e cultures module already.,0
All sounds good. Fingers . Makes it difficult to type,0
Y so late but i need to go n get da laptop,0
You know my old Dom I told you about yesterday ? His name is Roger? He got in touch with me last night and wants me to meet him today at number pm,0
So you think i should actually talk to him? Not call his boss in the morning? I went to this place last year and he told me where i could go and get my car fixed cheaper. He kept telling me today how much he hoped i would come back in how he always regretted not getting my number etc.,0
Hello boytoy ! Geeee Im missing you today. I like to send you a tm and remind you Im thinking of you And you are loved loving kiss,0
I dont think he has spatula hands!,0
Please sen emoji my kind advice emoji please come here and try emoji,0
Thts gods gift for birds as humans hav some natural gift frm god,0
Think I could stop by in like an hour or so? My roommates looking to stock up for a trip,0
We are both fine. Thanks,0
It has issues right now. Ill fix for her by tomorrow.,0
Princess is your kitty shaved or natural?,0
Aight sounds good. When do you want me to come down?,0
I havent add yet right,0
Hi mom we might be back later than ltgt,0
From next month get upto number More Calls number Ur standard network charge number activate Call number C Wire number net number st number Terms PoBox number M number number UZ Cost currency number min MobcudB more,1
Thats the way you should stay oh.,0
We not watching movie already. Xy wants number shop so im shopping w her now.,0
Mmmmmmm snuggles into you deep contented sigh whispers I fucking love you so much I can barely stand it,0
Thank you winner notified by sms. Good Luck! No future marketing reply STOP to number customer services number,1
Will do. Have a good day,0
tap spile at seven. Is that pub on gas st off broad st by canal. Ok?,0
As if i wasnt having enough trouble sleeping.,0
Hey sorry I didntgive ya a a bellearlier hunnyjust been in bedbut mite go number thepub l number tr if uwana mt up?loads a luv Jenxxx.,0
Sorry I missed you babe. I was up late and slept in. I hope you enjoy your driving lesson boytoy. I miss you too teasing kiss,0
Do you want a new Video phone? number anytime any network mins number Inclusive Video calls AND downloads number per week Free delTOMORROW call number or reply NOW,1
Great NEW Offer DOUBLE Mins DOUBLE Txt on best Orange tariffs AND get latest camera phones number FREE! Call MobileUpd number free on number NOW! or number stoptxt TCs,1
Go until jurong point crazy Available only in bugis n great world la e buffet Cine there got amore wat,0
Yes! I am a one woman man! Please tell me your likes and dislikes in bed,0
number number number tf number p,1
Ah poop. Looks like ill prob have to send in my laptop to get fixed cuz it has a gpu problem,0
I am in bus on the way to calicut,0
Mm that time you dont like fun,0
After completed degree. There is no use in joining finance.,0
Hows the pain dear?y r u smiling?,0
Book which lesson? then you msg me I will call up after work or sth Im going to get specs. My membership is PX number,0
Yeah just open chat and click friend lists. Then make the list. Easy as pie,0
New TEXTBUDDY Chat number horny guys in ur area number just number p Free number receive Search postcode or at gaytextbuddy.com. TXT ONE name to number,1
Many more happy returns of the day. I wish you happy birthday.,0
Yun ah.now wkg where?btw if go nus sc. wana specialise in wad?,0
Dude just saw a parked car with its sunroof popped up. Sux,0
Will u meet ur dream partner soon? Is ur career off number a flyng start? number find out free txt HORO followed by ur star sign e. g. HORO ARIES,1
That sucks. Ill go over so u can do my hair. Youll do it free right?,0
We are okay. Going to sleep now. Later,0
We tried to contact you re your reply to our offer of number mins number textand a new video phone call number now or reply for free delivery tomorrow,1
Pls go there today ltgt . I dont want any excuses,0
I like you peoples very much emoji but am very shy pa.,0
Or just do that number times,0
Are you available for soiree on June number rd?,0
Well done blimey exercise yeah i kinda remember wot that is hmm.,0
Prepare to be pleasured emoji,0
number s reach home call me.,0
Dear Voucher Holder number claim your number st class airport lounge passes when using Your holiday voucher call number When booking quote number st class x number,1
One small prestige problem now.,0
Yo carlos a few friends are already asking me about you you working at all this weekend?,0
She left it very vague. She just said she would inform the person in accounting about the delayed rent and that i should discuss with the housing agency about my renting another place. But checking online now and all places around usc are ltgt and up,0
Nope. Meanwhile she talk say make i greet you.,0
Can you do a mag meeting this avo at some point?,0
How dare you stupid. I wont tell anything to you. Hear after i wont talk to you:.,0
How are you doing. Hows the queen. Are you going for the royal wedding,0
got wat to buy tell us then no need to come in again.,0
R u over scratching it?,0
Aight lemme know whats up,0
Kate jackson rec center before number ish right?,0
Ok i vl do u know i got adsense approved,0
Until number lor Ya can go number dinner together,0
ou are guaranteed the latest Nokia Phone a number GB iPod MP number player or a currency number prize! Txt word: COLLECT to No: number ! IBHltd LdnW number H number pMtmsgrcvd number,1
I taught that Ranjith sir called me. So only i sms like that. Becaus hes verifying about project. Prabu told today so only pa dont mistake me,0
I dont want to hear anything,0
meet you in corporation st outside gap you can see how my mind is working!,0
But we havent got da topic yet rite?,0
Where are you lover ? I need you,0
.photoshop makes my computer shut down.,0
Ok lar Joking wif u oni,0
URGENT! Last weekends draw shows that you have won currency number cash or a Spanish holiday! CALL NOW number to claim. TC: RSTM SW number number SS. number ppm,1
Oh ic. I thought you meant mary jane.,0
Am on a train back from northampton so im afraid not! Im staying skyving off today ho ho! Will be around wednesday though. Do you fancy the comedy club this week by the way?,0
Yup im elaborating on the safety aspects and some other issues,0
Thank you so much. When we skyped wit kz and sura we didnt get the pleasure of your company. Hope you are good. Weve given you ultimatum oh! We are countin down to aburo. Enjoy!,0
K k when will you give treat?,0
I cant pick the phone right now. Pls send a message,0
That is wondar full flim.,0
Hi kindly give us back our documents which we submitted for loan from STAPATI,0
As in different styles?,0
We stopped to get ice cream and will go back after,0
I donno if they are scorable,0
Dunno i juz askin cos i got a card got number off number a salon called hair sense so i tot its da one cut ur hair.,0
Darren was saying dat if u meeting da ge den we dun meet number dinner. Cos later u leave xy will feel awkward. Den u meet him number lunch lor.,0
I tagged MY friends that you seemed to count as YOUR friends.,0
Genius whats up. How your brother. Pls send his number to my skype.,0
Draw va?i dont think so emoji,0
Hows ur paper?,0
No got new job at bar in airport on satsgettin number per hour but means no lie in! keep in touch,0
Thats cool! I am a gentleman and will treat you with dignity and respect.,0
Are you unique enough? Find out from number th August. www.areyouunique.co.uk,1
U in town alone?,0
I think that tantrums finished so yeah Ill be by at some point,0
Lmao. Take a pic and send it to me.,0
Then she buying today? no need to c meh,0
Thanks for sending this mental ability question,0
Ill call u number mrw at ninish with my address that icky American freek wont stop callin me number bad Jen k eh?,0
Oh emoji as usual vijay film or its different?,0
Rofl betta invest in some anti aging products,0
Whatever juliana. Do whatever you want.,0
Like a personal sized or what,0
Not yet chikku going to room nw im in bus,0
Pls send me your address sir.,0
I dunno they close oredi not v ma fan,0
But i juz remembered i gotta bathe my dog today,0
Dont show yourself. How far. Put new pictures up on facebook.,0
Missed your call cause I was yelling at scrappy. Miss u. Cant wait for u to come home. Im so lonely today.,0
Company is very good.environment is terrific and food is really nice emoji,0
Congrats! number year special cinema pass for number is yours. call number now! C Suprman V Matrix number StarWars number etc all number FREE! bx number ip number number we. number pm. Dont miss out!,1
So i could kiss and feel you next to me,0
Me too watching surya movie only. . .after number pm vijay movie POKKIRI,0
Do you know when dad will be back?,0
Rose for redred for bloodblood for heartheart for u. But u for me . Send tis to all ur friends Including me If u like me If u get back number u r poor in relation! number u need some number to support number u r frnd number many number some number luvs u number some number is praying god to marry u. emoji try it .,0
Why i come in between you people,0
For your chance to WIN a FREE Bluetooth Headset then simply reply back with ADP,1
number URGENT! This is the number nd attempt to contact U!U have WON currency number CALL number b number number TCsBCM number WC number N number XX. callcost number ppm mobilesvary. max currency number number,1
Wats my dear doing? Sleeping ah?,0
At the funeral home with Audrey and dad,0
Oh k im watching here emoji,0
Sorry for the delay. Yes masters,0
Want number get laid tonight? Want real Dogging locations sent direct number ur mob? Join the UKs largest Dogging Network bt Txting GRAVEL to number ! Nt. ec number a. number p.msg number p,1
How stupid to say that i challenge god.You dont think at all on what i write instead you respond immed.,0
HEY HEY WERETHE MONKEESPEOPLE SAY WE MONKEYAROUND! HOWDY GORGEOUS HOWU DOIN? FOUNDURSELF A JOBYET SAUSAGE?LOVE JEN XXX,0
URGENT This is our number nd attempt to contact U. Your currency number prize from YESTERDAY is still awaiting collection. To claim CALL NOW number ACL number PM,1
Yup he msg me: is tat yijue? Then i tot its my group mate cos we meeting today mah Im askin if leaving earlier or wat mah cos mayb haf to walk v far,0
Ah well that confuses things doesnt it? I thought was friends with now. Maybe i did the wrong thing but i already sort of invited tho he may not come cos of money.,0
Cool Ill text you in a few,0
Thanks for this hope you had a good day today,0
Omw back to tampa from west palm you hear what happened?,0
No need lar. Jus testing e phone card. Dunno network not gd i thk. Me waiting number my sis number finish bathing so i can bathe. Dun disturb u liao u cleaning ur room.,0
ALRITE,0
Tone Club: Your subs has now expired number resub reply MONOC number monos or POLYC number polys number weekly number p per week Txt STOP number stop This msg free Stream number,1
So ll be submitting da project tmr rite?,0
The guy did some bitching but I acted like id be interested in buying something else next week and he gave it to us for free,0
So that means you still think of teju,0
Does she usually take fifteen fucking minutes to respond to a yes or no question,0
I pocked you up there before,0
And is there a way you can send shades stuff to her. And she has been wonderful too.,0
Awesome Ill see you in a bit,0
number Tension face number Smiling face number Waste face number Innocent face number Terror face number Cruel face number Romantic face number Lovable face number decent face ltgt .joker face.,0
Ill text now! All creepy like so he wont think that we forgot,0
Yes. Nigh you cant aha.,0
Great! I have to run now so ttyl!,0
Im always looking for an excuse to be in the city.,0
Hi juan. Im coming home on fri hey. Of course i expect a welcome party and lots of presents. Ill phone u when i get back. Loads of love nicky x x x x x x x x x,0
Somewhr someone is surely made number u. And God has decided a perfect time to make u meet dat person. . . . till den . . . . . Enjoy ur crushes !!!),0
I aint answerin no phone at what is actually a pretty reasonable hour but Im sleepy,0
Ok i thk i got it. Then u wan me number come now or wat?,0
Shes fine. Good to hear from you. How are you my dear? Happy new year oh.,0
Sure thing big man. i have hockey elections at number shouldnt go on longer than an hour though,0
Im good. Have you registered to vote?,0
Why do you ask princess?,0
Dont think so. It turns off like randomlly within number min of opening,0
Hey are we going for the lo lesson or gym?,0
All done all handed in. Dont know if mega shop in asda counts as celebration but thats what im doing!,0
Hi this is yijue can i meet u at number tmr?,0
I want to show you the world princess emoji how about europe?,0
Just glad to be talking to you.,0
You should get more chicken broth if you want ramen unless theres some I dont know about,0
Ok i go change also,0
deep sigh I miss you emoji I am really surprised you havent gone to the net cafe yet to get to me Dont you miss me?,0
No de. But call me after some time. Ill tell you k,0
This is ur face test ( number number number number number number number number number ltgt ) select any number i will tell ur face astrology . am waiting. quick reply,0
Oh i will get paid. The most outstanding one is for a commercial i did for Hasbro in AUGUST! They made us jump through so many hoops to get paid. Still not.,0
Motivate Behind every darkness there is a shining light waiting for you to find it Behind every best friend there is always trust and love BSLVYL,0
Dude we should go sup again,0
Printer is cool. I mean groovy. Wine is groovying,0
Just come home. I dont want u to be miserable,0
Whenevr ur sad Whenevr ur gray Remembr im here number listn number watevr u wanna say Jus walk wid me a little whileamp I promise Ill bring back ur smile. emoji,0
What does the dance river do?,0
Night night see you tomorrow,0
What you thinked about me. First time you saw me in class.,0
no home work to do meh,0
Ive been trying to reach him without success,0
Idk. Im sitting here in a stop and shop parking lot right now bawling my eyes out because i feel like im a failure in everything. Nobody wants me and now i feel like im failing you.,0
ltgt of pple marry with their lovers becz they hav gud undrstndng dat avoids problems. i sent dis number u u wil get gud news on friday by d person you like. And tomorrow will be the best day of your life. Dont break this chain. If you break you will suffer. send this to ltgt frnds in ltgt mins whn u read,0
U can call me now,0
Oh I was thkin of goin yogasana at number den no nd to go at number den can rush to parco number nb Okie lor u call me when ready,0
Just wait till end of march when el nino gets himself. Oh.,0
